{
  "$schema": "https://json-schema.org/draft/2020-12/schema",
  "$id": "https://raw.githubusercontent.com/GLOBAL-AI-GOVERNANCE/global-ai-governance-toolkit/v2.7.2/examples/agent_action_assurance/input.schema.json",
  "title": "Synthetic Agent Action Assurance Input (Candidate)",
  "description": "Candidate-only structural contract; runtime applies additional semantic checks.",
  "type": "object",
  "additionalProperties": false,
  "required": [
    "schema_version",
    "case_id",
    "agent_id",
    "sdk",
    "policy",
    "monitor_status",
    "observation_coverage",
    "actions",
    "evidence"
  ],
  "properties": {
    "schema_version": {
      "const": "0.1.0"
    },
    "case_id": {
      "type": "string",
      "minLength": 1,
      "maxLength": 200
    },
    "agent_id": {
      "type": "string",
      "minLength": 1,
      "maxLength": 200
    },
    "sdk": {
      "type": "string",
      "minLength": 1,
      "maxLength": 200
    },
    "policy": {
      "type": "object",
      "additionalProperties": false,
      "required": [
        "id",
        "authorized_tools",
        "approval_required_for",
        "valid_from",
        "valid_until",
        "revoked_at"
      ],
      "properties": {
        "id": {
          "type": "string",
          "minLength": 1,
          "maxLength": 200
        },
        "authorized_tools": {
          "type": "array",
          "maxItems": 200,
          "uniqueItems": true,
          "items": {
            "type": "string",
            "minLength": 1,
            "maxLength": 200
          }
        },
        "approval_required_for": {
          "type": "array",
          "maxItems": 200,
          "uniqueItems": true,
          "items": {
            "type": "string",
            "minLength": 1,
            "maxLength": 200
          }
        },
        "valid_from": {
          "oneOf": [
            {
              "type": "string",
              "pattern": "^\\d{4}-\\d{2}-\\d{2}T\\d{2}:\\d{2}:\\d{2}Z$"
            },
            {
              "type": "null"
            }
          ]
        },
        "valid_until": {
          "type": "string",
          "pattern": "^\\d{4}-\\d{2}-\\d{2}T\\d{2}:\\d{2}:\\d{2}Z$"
        },
        "revoked_at": {
          "oneOf": [
            {
              "type": "string",
              "pattern": "^\\d{4}-\\d{2}-\\d{2}T\\d{2}:\\d{2}:\\d{2}Z$"
            },
            {
              "type": "null"
            }
          ]
        }
      }
    },
    "monitor_status": {
      "enum": [
        "ACTIVE",
        "DISABLED",
        "UNKNOWN"
      ]
    },
    "observation_coverage": {
      "enum": [
        "COMPLETE_DECLARED",
        "INCOMPLETE",
        "UNKNOWN"
      ]
    },
    "actions": {
      "type": "array",
      "minItems": 1,
      "maxItems": 200,
      "items": {
        "type": "object",
        "additionalProperties": false,
        "required": [
          "id",
          "tool",
          "policy_id",
          "at",
          "control_decision",
          "execution_observation",
          "approval",
          "evidence_ref"
        ],
        "properties": {
          "id": {
            "type": "string",
            "minLength": 1,
            "maxLength": 200
          },
          "tool": {
            "type": "string",
            "minLength": 1,
            "maxLength": 200
          },
          "policy_id": {
            "type": "string",
            "minLength": 1,
            "maxLength": 200
          },
          "at": {
            "type": "string",
            "pattern": "^\\d{4}-\\d{2}-\\d{2}T\\d{2}:\\d{2}:\\d{2}Z$"
          },
          "control_decision": {
            "enum": [
              "ALLOW",
              "DENY",
              "UNKNOWN"
            ]
          },
          "execution_observation": {
            "enum": [
              "EXECUTED",
              "NOT_OBSERVED",
              "UNKNOWN"
            ]
          },
          "approval": {
            "enum": [
              "GRANTED",
              "NOT_REQUIRED",
              "DENIED",
              "UNKNOWN"
            ]
          },
          "evidence_ref": {
            "type": "string",
            "minLength": 1,
            "maxLength": 200
          }
        }
      }
    },
    "evidence": {
      "type": "array",
      "minItems": 1,
      "maxItems": 200,
      "items": {
        "type": "object",
        "additionalProperties": false,
        "required": [
          "reference",
          "sha256"
        ],
        "properties": {
          "reference": {
            "type": "string",
            "minLength": 1,
            "maxLength": 200
          },
          "sha256": {
            "type": "string",
            "pattern": "^sha256:[0-9a-f]{64}$"
          }
        }
      }
    }
  }
}
